sentiment_label,tweet_text
1,can you tell its spring break here boys are off school so i dont have to be up at first light and can actually stay up late 
1,just saw the new night at the museum movieit wasokaylol 
0,dropping brooke off at stablethen headed to workout amp class afteri have way way too much schoolwork to do 
0,time warners hd line up is crap
1,lakers tonight lets go
0,colin powell rocked yesterday on cbs cheney needs to shut the hell up and go homepowell is a man of honor and served our country proudly
1,eww maths one day till holidays 
1,yankees won mets lost its a good day
1,spinuzzi has been a bit crazy with steep learning curve but lyx is really good for long docs for anything shorter it would be insane
1,sony coupon code expires soon httpwwwcoupondorkcomr
0,wthi have never seen a line this loooong at time warner before ugh
1,tom shanahans latest column on sdsu and its ncaa baseball regional appearance httpowlyaxhu
1,bout to hit safeway i gotta eat
1,tommcfly hello you should have the cereal with loads of sugar 
0,skip the bbq im upgrading my iphone to os  then jailbreaking it i need my customizations sorry apple 
1,just changed my default pic to a nike basketball cause bball is awesome
0,shammysticks  baby im sorry i miss you so much
1,im listening to pyt by danny gokey lt lt lt aww hes so amazing i lt him so much 
0,httptwitpiccommbag  found this knit racerback sleeveless in ottawa and loved it  of the  things i got to purchase  no time f 
1,getting ready to test out some burger receipes this weekend bobby flay has some great receipes to try thanks bobby
0,its official sackboy cuddly toys are better than pups nieces dog now living with my other brother as roddy sackboy is more fun 
1,rt justindavey rt tweetmeme gm onstar now instantly sends accident location coordinates to   gps obsessed httpbitlyszl
0,pissed at time warner for causin me to have slow internet problems
0,malcolm gladwell is a genius at tricking people into not realizing hes a fucking idiot
1,house correspondents dinner was last night whoopi barbara amp sherri went obama got a standing ovation
0,off to pick up my camera equipment instead of cuddling wit mia 
0,just got back from church and i totally hate insects
1,safeway is very rock n roll tonight
0,karoli i firmly believe that obamapelosi have zero desire to be civil  its a charade and a slogan but they want to destroy conservatism
1,i like saving money 
1,icywings just downloading it now icywill let you know what i think when i watch it 
1,how to implement a news ticker with jquery and ten lines of code httpbitlycznfj
1,i lam so in love with bobby flay he is my favorite rt terrysimpson bflay you need a place in phoenix we have great peppers here
0,taking a walk one hour from home and the sky just opens 
1,will the lakers kick the nuggets ass tonight
0,ahh ill die from this stomach ache   
1,i love my kindle no more stacks of books to trip over on the way to the loo
0,ambcharlesfield lol ah my skin is itchy  damn lawnmowing
1,wow everyone at the google io conference got free gs with a month of unlimited service
1,just got my new toy canon d love love love it
0,is upset about the whole gm thing life as i know it is so screwed up
1,wordwhizkid lebron is a beast nobody in the nba comes even close
1,another bright sunny day  island must have driftered south over the last few days  oh well time to eat then off to work
0,the first available date was tomorrow but mom said no 
1,just watched night at the museum  so stinkin cute
1,the great indian tamasha truly will unfold from may  the result day for indian general election
0,morbay i know which one i prefer i thought the same thing and got excited over nothing 
1,nike owns nba playoffs ads w lebron kobe carmelo httpowlyuiy  adidas billups howard  marketing branding
0,i wanna go to the beach 
0,i say we just cut out the small talk atampts new slogan fk you give us your money apologies to bob geldof
0,pinky finger on my right hand has gone numb  apparently caused by using a computer mouse too much 
0,karawr that sucks that your relationship ended on such a bad note  thinking of you
1,after using latex a lot any other typeset mathematics just looks hideous
0,going to lepeep for breakfast  i feel like a crepe did i spell it right then to the cubs game wish my bf could go but he has to work 
0,took the graduate field exam for computer science today  nothing makes you feel like more of an idiot than lambda calculus
0,omg so bored amp my tattoooos are so itchy  help aha 
0,reading the tweets coming out of iran the whole thing is terrifying and incredibly sad
0,why does my wpf application keeps crashing on my fresh installed windows xp virtual pc 
1,going to see star trek soon with my dad
1,jayjayklees well i think you should go search for the pot of gold 
0,annoying new trend on the internets  people picking apart michael lewis and malcolm gladwell  nobody wants to read that
1,i think i may have a new favorite restaurant on our way to see night at the museum 
0,i still love my kindle but reading the new york times on it does not feel natural i miss the bloomingdale ads
1,waiting in line at safeway
0,insects have infected my spinach plant 
1,in montreal for a long weekend of rampr much needed
1,jquery ui  book review  httpcfbloggersorgc
0,tmrw will be the last day to teach my little kiddos they were such a greatfun and adorable students of mine sad to say goodbye 
1,awesome viral marketing for funny people httpwwwnbccomyoteach
1,obamas got jokes haha just got to watch a bit of his after dinner speech from last night im in love with mr president 
1,the ever amazing psyop and goodby silverstein amp partners for hp httpbitlygru have to go play with after effects now
0,cant sleep my tooth is aching
1,still thinks twitter is a hipster circle jerk 
0,recovering from surgerywishing julesrenner was here 
0,stuffnews cant believe i missed free albums   oh well at least i took advantage of tescos free music glitch
0,damnit  oklcok already grrr gotta get ready 
0,trying to book the nct for the car is a nightmare grrrrrrrrrrr 
0,man i kinda dislike apple right now case in point the iphone gs wish there was a video recorder app please httpbitlydzmt
1,freitasm oh i see i thought atampt were mhz wcdma
1,fakecedric hey ced this is kingdomguard 
1,robsmaid thanks 
1,snufsnuf im living in penang its far from singapore plus im just getting started on im so maybe a little while before i can go travel 
1,maymaym my kfanyc is not up because i do not have server space  will fix that in may  everything can happen in may 
1,maddysen lol omg check my profile in  mins 
1,rt latimesautos is now the time to buy a gm car httpbitlynrzlu
0,f up big or go home  aig
1,cant stop laughing 
0,why do people step away and get afraid when love is always standing right in front of their face   jm
1,judd apatow creates fake sitcom on nbccom to market his new movie viral marketing at its best httpisgdkyk
1,hey guys everyone add mattwayneceleb please and thank you 
0,openoffice fails to open the biggest scariest excel spreadsheet ive ever seen oh well rebooting into windows 
1,beginning javascript and css development with jquery javascript css jquery httpbitlytoe
1,jorskwen omg i sooo cannot wait once its properly ready will take pix and upload k 
1,on my way to see star trek  the esquire
1,jaybrannan it doesnt  just take it and run with it 
0,rt sportsguy the upside to time warner unhelpful phone operators   superslow onsite service crap thats not an upside
0,rcwpong work 
1,my exam went good helloleonie your prayers worked 
0,kicksandchicks aaaww tht suck  not fair temper tantrum
0,just got mcdonalds goddam those eggs make me sick o yeah laker up date go lakers not much of an update well its true so suck it
1,blondebroad its definitely under warranty amp my experience is the amazon support for kindle is great had to contact them about my kindle
0,ugh the amount of times these stupid insects have bitten me grr
1,devo i know i just hadnt had one in such a long time the goodness surprised me 
0,mariahtyson nothing quite like hitting the beltway at pm while its storming 
1,still hungry after eating
1,i saw night at the museum battle of the swithsonian today it was okay your typical kids ben stiller movie
0,played with an android google phone the slide out screen scares me i would break that fucker so fast still prefer my iphone
1,new blog post nike sb dunk low premium white gum httptrimlott
0,the safeway bathroom still smells like ass
1,off to the nike factory
1,httprapidsharecomfilessummercdziphtml a mix i made if you want to listen to some newish indie poprock stuff 
0,doesnt like when there isnt anyone at the office to entertain me 
1,ronjon we dont have safeway
1,stanford universitys facebook profile is one of the most popular official university pages  httptinyurlcompbfl
1,ramoso hihi i love it drinking red bull in the morning  
1,rt blknprecious rt great dbroos someones sitting in the shade today because someone planted a tree a long time ago warren buffet
1,shannyoday i will take you on a date to see night at the museum  whenever you wantit looks soooooo good
1,ruthylany awesome i love that show no i didnt see it but i did record it so ill probably watch it in a little bit  ryans cute
0,so tired    and feeling like a cold is coming on dammit
0,local michaels shop didnt have comic book inking paper 
1,kumar sanu calls current film songs shouting well at least singers dont shout from their noses these days  httptrimimzw
1,faithbabywear ooooh what model are you getting i have the d and love love love love it
0,night at the museum tonite instead of up  oh well that  yr old better enjoy it lol
1,louisgagliardi hahaha shiiit dont i feel like a douche bag  hehe thx for the tips anyway  much appreciatedim glad to be different
0,i hate the dentistwho invented them anyways
1,absolutely hilarious from mashable  httpbitlybccwt
1,obama more popular than us among arabs survey president barack obamas popularity in leading arab countries  httptinyurlcomprlvqu
0,royalascot  lost the first race not starting well 
1,gooooooooood morning twitterville i wonder what today will bring and which song ill have stuck in my head most of the day 
0,skyward poor sky  why did you get it taken away
1,sleeping under the stars 
0,daisywhitney cool i will thanks unfiortunately i have no topic ideas for you 
1,just bought the best scarf ever 
1,i am happy for philip being at googleio today
0,time warner cable slogan where calling it a day at pm happens
0,i wanna watch notorious again 
0,blah blah blah same old same old no plans today going back to sleep i guess
0,dearest google you rich bastards the visa card you sent me doesnt work why screw a little guy like me
1,kobe is good bt lebron has my vote
0,aidaa uh did i miss the quotclever commentquot i think i did 
1,got my wave sandbox invite extra excited too bad i have class now but ill play with it soon enough io wave
1,sarcasm hits me every time as well 
0,just landed in flint mi the weather here is horrible  i miss la already
1,lebron best athlete of our generation if not all time basketball related i dont want to get into intersport debates about   
0,shaundiviney your not gonna call the western australian people at  are you cause were two hours behind so we will still be in school 
0,gah i cant sleep its  in the morning i think the vogs been getting to me hawaii has not been quotparadisequot lately 
1,sklososky thanks so much from one of your very happy kindle winners   i was so surprised fabulous thank you best kathleen
0,first time being late for work   only by like  mins tho watched s darko last nightwtf guess i should watch donnie darko first
0,my engine light just turned on what last thing i need seriously 
0,says quotgreatquot now we cant eat farmed fish else we will get mad fish disease  httpwwwtgdailycomcontentview
0,thizgurl send me a myspace friend request ill dm my last name cant believe the treasure hunt is over b it started 
1,two tests down  three tests and a twenty first birthday to go  
1,my dentist appt today was actually quite enjoyable
1,i have eight days off in new york before dance booking my flight now 
1,rt look available amazon kindle amp kindle dx get it here httpshorttoub the top electronic book reader period free  day ship 
0,finger is hurtin  x
0,this is not a good morningsum may need  come take care of mefeelin so miserable right now 
0,sportsguy time warner  epic fail
1,waiting for the clock to turn  so i can go home 
0,could timewarner cable suck more  no
0,is kinda wishing that youd talk to her 
1,ryanhopesudie i agree entirely wont have to wait too much longer 
1,amy well well welllook who it is  welcome to this crazy twitter worldhahahha
1,watching comedian nick griffinquotlife is difficult thats why i love sleepingits like temporary suicidebut you wake up refreshedquot  
1,obamas speech was pretty awesome last night httpbitlyimxum
1,innocentnite thats ok it was funny lol 
0,getfollowed typical way of getting money on the net tell ppl its free but a lot better if they pay for it 
1,trying to figure out this twitter thing 
1,learning jquery  book review  httpcfbloggersorgc
1,cwong i have a kindle amp sony prs like it physical device feels good font is nice pg turns are snappy enuf ui a little klunky
0,now i can see why dave winer screams about lack of twitter api its limitations and access throttles
1,tonyhawk httptwitpiccomcuj  awesome seeing the show friday at the shoreline amphitheatre never seen nin before cant wait 
1,by the way im totally inspired by this freaky nike commercial httpsnurlcomicgj
0,emboosh nope london      are you going to jb on th november
1,at gwt fireside chat googleio
0,has pins and needles in her tootsies 
1,we went to stanford university today got a tour made me want to go back to college its also decided all of our kids will go there
1,i seriously underestimated malcolm gladwell  i want to meet this dude
1,damohopo thankyou  bet your eye looks lovely consider an eye patch if only to spare others pain on looking at your gooey eye 
1,myfwarhurst quothead onquot by pixies because the video is awesome and underplayed 
1,tomorrow should be a great day im actually going on a date wowthis should be interesting 
1,johannacherry come stay at mine on friday 
1,tommcfly haha morning then i think aussie here wheat bix with honey or maple syrup and milk 
1,i loved night at the museum
0,i miss you 
0,it is a shame about gm what if they are forced to make only cars the white house thinks will sell what do you think
1,swirlyarts thanks for featuring me on cuteable yesterday 
0,luke and i got stopped walking out of safeway and asked to empty our pockets and lift our shirts how jacked up is that
0,logic nah have exams till th 
0,missing my beautiful bumble bee 
0,i srsly hate the stupid twitter api timeout thing soooo annoying 
0,cheney and bush are the real culprits  httpfwixcomarticle
1,heiko yes she is  httptwittercomsevinnyne
0,history exam studying ugh
1,lou lebron is murdering shit
1,devsnippets  jquery tools  javascript ui components for the web httpinblogsorggohfuqt
0,found nothing at nike factory  off to banana republic outlet httpmylocmezic
0,andreaexmarie haha yup  i would die without lip injections ive got baby lips natrually  its  every  months do it
0,wolfram alpha sucks even for researchers the information provided is less than you can get from google or wikipedia totally useless
1,im ready to drop the pretenses i am forever in love with jquery and i want to marry it sorry ladies this nerd is jqueryspokenforjs
0,jdreiss oh yes but if gm dies it will only be worth more boo hahaha
1,time warner ceo hints at online fees for magazines      ap  read from mountain viewunited states views  httpbitlyudfch
0,confirmed its time warners fault not facebooks that fb is taking about  minutes to load so tempted to switch to verizon 
1,new blog post nike trainer  httpbitlybp
0,time warner cable is down again rd time since memorial day bummer
0,maeread just saw your tweet from monday  im happy monday was looking a bit up btw uncanny i need to organize  emails
1,brand new canon eos d mp dslr camera canon mm is lens  web technology thread brand new canon eos  httpumavrevcomat
1,is in san francisco at bay to breakers
0,this dentists office is cold 
0,loobylou omg no you poor thing  twug from me 
1,gm says expects announcment on sale of hummer soon  reuters wdsugm says expects announcment on sale of hummer  httpbitlyefv
1,as another long day begins james is glad its sunny stay away nasty rain 
1,sochi i current use the nikon d and love it but not as much as the canon dd i chose the d for the  video feature my mistake
1,shout outs to all east palo alto for being in the buildin karizmakaze cal gta also thanks to profits of doom universal hempz cracka
1,loves twitter
0,fck time warner cable you fcking suck balls i have a  hd tv amp my damn hd channels hardly ever come in bullshit
1,home  yay bought so many nice things in the city today 
1, orkuts team cleaned the phishing link in few hours and responded to me with a thank you note 
1,just typed up massive trench warfare plans for the defense of the papal states in  lt forumbased geopolitical wargames 
1,prettiest insects ever  pink katydids httpbitlyupwp
1,inducted the new flofficers tonight 
0,well morning im hardly having a good morning i am now single and i must say it does suck im not used to this    tear
1,scrivener i didnt say it was correct just what i thought 
0,just woke up im definitely not ready to leave nyc 
1,getting ready to go watch night at the museum   dum dum you give me gum gum
1,safeway supermarketing via mobile coupons httpbitlyonhw
0,im so tired 
0,i want to go home earlier and try playing street fighter  
0,up againi really need  go  da doctors about dis insomniai cant remember da last time i had a good night sleepughhhhh 
1,kirstiealley pet dentist httpwwwfunnyvillecomfvpicturesdogdenturesshtml
1,saudarilee hey hey where did you get the man u rompers are there any other club rompers available thanks  zee
1,scrivener afterwards spoke with my mom  she argued in your defense ahupuaa and all 
1,for those who are puzzled by umtweeti wam 
0,waiting  my final   
0,i shouldnt be twittering i should be on eclass 
1,and also im leaving  see you on the train all 
0,naive bayes using em for text classification really frustrating
1,time warner cable pulls the plug on the girlfriend experience  wwwtinyurlcommfk
0,looking up info about european union and turkey man do i hate history projects 
1,bricksht ugh i hate you we got snow in the middle of aprildont you just miss canada   ends sarcasm
1,need suggestions for a good ir filter for my canon d  got some pls dm
1,nicolevilareal heyy yess  whats up dude
0, i am doing work 
1,ok so dunkroos could not be found but i found something called dunk ems and the flavor is quotawesomely oreoquot i shall now try it 
0,i love donuts but i think i have to avoid them now im gaining too much weight 
0,missing his meg on our first month together 
1,ahh yes lol ima tell my hubby to go get me sum mcdonalds 
1,phatelara awesome debbs 
0,my back hurts so much 
0,whoever is running time warner needs to be repeatedly raped by a rhino so they understand the consequences of putting out shitty cable svcs
1,hematocrit are you serious 
1,using linux and loving it  so much nicer than windows looking forward to using the wysiwyg latex editor
0,omg the commercials alone on espn are going to drive me nuts
1,lawson to head newedge hong kong httpbitlyxlqsd business china
1,today its biz side vs dev side yunoo  tennis bowling amp beers let the games begin
0,sakararossof man im definitely pissed i need  stay off the phone and study more just got my test back amp im not pleased 
0,tummy ache 
0,bonjour san francisco my back hurts from last night
1,climate focus turns to beijing the united nations the us and european governments have called on china to coo httptinyurlcomlton
1,eating cake
1,all about ajaxjquery css javascript and more many examples httpajaxiancom
1,finished reading st book of the hollows series by kim harrison dead witch walking loved it  started book  already  
0,i want you so bad 
0,wakeupmaggie sorry i missed your blog tv last night  i went to bed early because i have to get up early for work
1,off to the bank to get my new visa platinum card
1,weeeeeeh its almost tomorrow today 
1,new nike muppet commercials are pretty cute why do we live together again
0,pookahkol you mean youd forgotten 
1,going to see night at the museum  with tall boy
1,httpxigsfo gm ceo china will continue to be key partner
1,here are your three videos use them to meditate  httptinyurlcomebbod httptinyurlcomebbod httptinyurlcomebbod
0,doing a lot of school work listening to spice girls lt loved them since i was really young too bad they didnt have a concert here 
1,i love lebron httpbitlypdhur
1,baseballamericacom blog baseball america prospects blog  blog  httpbitlyetta
1,with the boyfriend eating a quesadilla
1,ahhh back in a real text editing environment i lt latex
1,im really loving the new search site wolframalpha makes google seem so  quaint httpwwwwolframalphacom
1,giving weka an app engine interface using the bird strike data for the tests the logo is a given
1,guess ill be retiring my g and start using my developer g woot googleio
0,amyfergface amy i miss you i wish you still lived in stoke 
0,my dentist was wrong wrong
0,stopped by office depot going to work in a bit 
0,schoolrun time oh the joys especially in the rain 
1,jhonenv what a precious photo makes me want to pinch your cheeks 
1,i mean im down with notre dame if i have to  its a good school id be closer to dan id enjoy it
0,arg twitter api is making me crazy
0,just got barraged by a horde of insects hungry for my kitchen light so scary
1,ive been sending emails like crazy today to my contactsdoes anyone have a contact at goodby silversteinid love to speak to them
0,why the hell is pelosi in freakin china and on whose dime
1,thisismyiq q g t bed  wat r u doinggggg
1,feeling a bit better this morning  j let us lie in until  which was nice but means i am now rushing to get into work 
1,lagiggles have a beautiful y safe trip lots of hugs y hearts 
1,airplanemancf you are so right  thanks for that always nice to have some positive people around
1,woohoo just beat simxs ass at typeraceronce 
1,im going to bed it was a successful weekend stanford here i come
1,in our new feature were launching tomorrow i am going to launch a new list quotpeople i really trustquot  good night
1,sf bay area rides i want a ride please  sc gt la santa cruz anyone perhaps going to l httptinyurlcomcactjn
1,just landed at san francisco
0,pissed about atampts midcontract upgrade price for the iphone its  more im not going to pay  for something i thought was 
1,today was good  going to shower now then watch family guy
1,ingridmusic infatuated with twitter like me too bad i dont have many followers you should listen to a recording ive done 
1,hello twitter api 
1,listening to songs  
0,i hate the effing dentist
0,its a bank holiday yet im only out of work now exam season sucks
1,moonfrye i find your tweets are extraordinarily and consistently positive given my own last tweet i could take a page from your book 
0,man today is sstephdewhurst s last day of school  at our school anyways im so sad
0,everything is soaked 
0,the more i hear about this gm thing the more angry i get billions wasted more bullshit all for something like k employees and all the
1,apart from itunes can anyone recommend a good and reasonable download site and i should say quotlegitimatequot 
0,im sick  i have a sore throat blocked nose and a throat full of phlegm yum
1,vkerkez dood i got a free google android phone at the io conference the g
1,blueaero ooo its fantasy  i like fantasy novels   will check it out
1,lebron and zydrunas are such an awesome duo
0,cleaning the aptlast day here 
1,learning about lambda calculus 
1,darthweef thx you guys would definately had fun but i do know you were already having awesome times in sf part of revs scam school 
0,brain misfiring due to people dissing astral weeks which i know is a tediously canonical album but remains my alltime fave 
0,just had lunch with debbie  got  get the kids from school soon 
1,obama nationalization of gm to be shortterm   ap httptinyurlcommdr
1,jonathanrknight thanks for the sermon lol i was asleep when you wrote it but it was nice to wake up to the simple lifeif only  x
1,investigation pending on death of stanford cs prof  google mentor rajeev motwani httpbitlylwour tip techmeme
1,benhafner i would have to agree that jocam is quite an amazing girland in a few weeks ill be having dinner with an amazing couple 
1,rt designplay goodby silversteins new site httpwwwgoodbysilversteincom i enjoy it nice find
1,cheekipoo dont let that stop you coming along 
1,ok do nothing just thinking about d
0,i cant watch tv without a tivo  and after all these years the timewarner dvr  still sucks httpwwwdavehittcommarchtwdvrhtml
1,lizlin sad to say i just take multivitamins i guess im getting old  oh yeah if i hold the quotpquot will i get more vitamins lmao
1,tayswift im glad to hear im not the only one awake at  in the morning 
1,nike sb blazer high acg custom  brad douglas  httptimesurlata
0,tidycat i burned my finger when i tried to take my oatmeal out from the microwave boooo 
0,nooooooo my dvr just died and i was only half way through the ea presser hate you time warner
0,cant wait till i get to sleep in till noon or later i havent slept in for such a long time and i  am missing it so tired  it sucks
0,kirstiealley my dentist is great but shes expensive
1,so night at the museum  was awesome much better than part  next weekend well see up
1,finally got approved for the apartment mandy and i really deserve it 
0,iheartseverus we love you too and dont want you to die  latex  the devil
