sentiment_label,tweet_text
0,my internet connection is so slow 
1,laying in bed i have high hopes its going to be good  god is good  
1,pambeeslyjenna jenna i went to see night at the museum  today and i was so surprised to see three cast members from the office
1,im excited for rescue me to start tomorrow or is it today 
1,hi there does anyone have a great source for advice on viral marketing httplinkgsytz
1,the kindle seems the best ereader but will it work in the uk and where can i get one
1,any twitter to aprs apps yet
1,lsndr good luck girl 
1,jquery cheat sheet httpwwwjavascripttoolboxcomjquerycheatsheet
1,myfoxdc barrie students back from trip to china a silver spring high schools class trip to china has en httptinyurlcomnlhqba
1,midlifecrunch strange your page is just like our company 
1,apreezyl haay can you tell me the attendance question for personal computer tomorrow thanks  lt
1,heading to san francisco
1,adamcsmith re your french word sorry but it looks like youre going to have to try harderits down   
1,mileycyrus if its less than an hour of sleep its napping but more than an hour is sleeping 
1,watching lebron highlights damn that niggas good
0,fighting with latex again
0,quotthis version of the iphone software  is the current versionquot boo getting iphone  os was to be my highlight of the day 
1,dentist tomorrow have to brush well in the morning like i make my hair all nice before i get it cut why
1,check this video out  president obama at the white house correspondents dinner httpbitlyimxum
0,although todays keynote rocked for every great announcement atampt shit on us just a little bit more
1,knitluck i have crocheted washcloths in my store  afghanartistry 
1,looooooong day ahead another sunny day 
1,khalid no lebron is the best
1,night at the museum wolverine and junk food  perfect monday
1,excited about mi promisin future i need a spiritual cleanse im prayin then its off to bed  night twittheads
0,hmmm looks like iphoneipod touch  will be available around am mdt  too bad i wont be home till after pm tonight 
0,comcast sucks
1,good morning mariaandros i like that song too im praying now 
0,rt smartchickpdx was just told that nike layoffs started today 
0,karrisfoxy if youre being harassed by calls about your car warranty changing your number wont fix that they call every number dbags
1,my kindle came and i love it 
1,how to track iran with social media httpbitlyboqu
0,musewire is there anywhere to get definate u support dates flying over to nyc for the gig on th and dont want to miss out by one day 
0,pausette i miss plane letters too  i remember we used to write them for each other and letters you sent us in london 
1,mitzs hey bud  np i do so love my d although id love a d mkii more
0,i just realized we three monkeys in the white obamabidenpelosi  sarah palin 
1,rt jessverr i love the nerdy stanford human biology videos  makes me miss school httpbitlytnr
1,msnichole i love purses u shud send me some 
0,shaunwoo haten on aig
1,did not realize there is a gym above safeway
0,someone took the canes magnets off my car  i am tempted to paint logos on now fb
0,wtf stupid earphones i cant hear my music nowim sad 
0,obviously not siding with cheney here httpbitlyjd
1,yoyoma lol  isnt it past your bedtime it is for me see you tomorrow  
0,saw night at the museum out of sheer desperation who is funding these movies
0,listening to obama friggin north korea
0,is really sleepy and has a headache 
1,sooo freaking tired glad its almost the break soo i can sleep in cant wait to head to weyburn after easter 
1,sathyabhat ahan  let me eat his head then danke
1,men without hats  safety dance is dah best song ever created of all time starts to dance    lt    
1,dougiemcfly good morning dougie and tom how are you today 
0,been up for an hour due to loving annoying cats that wanted to snuggle with us cant go back to sleep  i feel like im on japan time
1,franceskim thanks i had a lot of funvegas is always a good time for me 
0,i just created my first latex file from scratch that didnt work out very well see amandabittner  its a great time waster
1,i highly recommend malcolm gladwells the tipping point my next audiobook will probably be one of his as well
1,san francisco today  any suggestions
1,wohoooo wilco is coming to pukkelpop do you think i can invite them for a good coffee at my house  
1,kenichan close but no cigar  bananatoffee 
0,big tingz nite  hosting a gig for bbc worldwide at tv centre with swamimusic amp baaba maal  sore throat though  croak croak
1,lol  no one commenting on my posts  i feel soooo loved
0,i am furious with time warner and their phone promotions
1,acmaster haha yes it would be cool but im pretty sure my cookies dont know anything about political bias in cable news 
0,capplegate i am so sad that samatha who was cancelled it was one of my favorite shows   i still cant understand why and i am so bummed
1,testing twitter api remote update
1,has a date with bobby flay and gut fieri from food network
1,heres a case study on how to use viral marketing to add over  people to your list httpsniprcomioz
0,back from seeing star trek and night at the museum star trek was amazing but night at the museum was eh
1,testing twitter api
0,broskiii oh snap you work at atampt dont you
1,shalinique booo ur just being urselfn we love it 
1,last call soon slow night 
1,is coloring 
0,i hate time warner soooo wish i had vios cant watch the fricken mets game wo buffering i feel like im watching free internet porn
0,safari  is fast  even on my shitty atampt tethering
1,yay i actually slept this morning 
0,kobe is the best in the world not lebron 
1,watching spongebob till i fall asleep 
1,httptwurlnlepkrb  awesome come back from biz via fredwilson
1,just started playing major league baseball k httpraptrcomhllgwar
1,cant wait for the great american food and music festival at shoreline tomorrow  mmmkatz pastrami and bobby flay yes please
1,xphile i have three words for you safeway dot com
0,jobadge no java script on this bobbins notebook 
1,kyleandjackieo god send me some of your clothing that you dont want hangbags too please anything ill cherish it 
1,grimtorn you can start making a religion of your own to make yourself fall asleep them 
1,html  demos lots of great stuff to come yes im excited  httphtmlfiveappspotcom io googleio
1,sleeeep time ill check back in tomorrow  raining tomorrow wtheck
1,omgg i ohhdee want mcdonalds damn i wonder if its open lol 
1,saw night at the museum  last night pretty crazy movie but the cast was awesome so it was well worth it robin williams forever
1,rt jquery the ultimate jquery list  httpjquerylistcom
1,just applied at safeway yeeeee
0,pittstock gm good riddance  sad though
1,is home from justins farewell dinner dont die 
1,mluc customer innovation award winner booz allen hamilton  httppingfmchpp
1,is watching prince turns to frog  httpplurkcompnbs
1,rokchic no probs i sell nothing other than my blog httpsnedwancom  ill have to get a listen to your band on itunes
1,man accosts roger federer during french open httpffimhcpt
0,clumsyxheart  ugh im so sorry does she blame you for not making an effort to do stuff  shesh im so sorry
1,kalpenn maaan im going to miss kutner he was my favorite on the show keep being awesome kal 
1, barack obama shows his funny side  gtgt httptrimlgy  great speech
1,rilespuppy amp puppyjamaica morning pups thanks for the follow look fwd to barking at you soon  this twitter is going to the dogs
1,lounging around eating taco bell and watching ncis before work tonight need help staying awake
1,nvidia names stanfords bill dally chief scientist vp of research httpbitlyfvvg
0,jenscloset it sure isnt but it happens more and more as i get older 
1,planning to learn basic sign language these holidays  geez i have a whole list o
0, and a half more hours before i can go home and relax im starving i ment to bring a salad but forgot 
0,atampt is complete fail
1,djlogansama ugh that first now should be a know its your fault for making me stay up late on a monday 
1,hi ladyexec found you through mrtweet loved the positivity in your mini bio and thought it would be good to connect 
0,must play catch up at work since i took yesterday off no fun 
0,the day i never have to deal with comcast again will rank as one of the best days of my life
1,mie no thanks i dont like jail 
0,zsbcreations annoying they should turn off that option i was searching for nice things  grrrrrr
1,psychemedia i really liked kswedbergs learning jquery book httpbitlypglt is worth a look too
0,gcsriotgurl not much at my stupid grandmoms house in oxford 
1,according to the create a school notre dame will have  receivers in ncaa  at  or higher rating  sweet
0,idk what  do 
1,just got back from the movies  went to see the new night at the museum with rachel  it was good
0,sheaquinn what is that orange top i dont remember this pic  reminds me to update mine too
1,jobs sittercity help with taking care of sick child east palo alto ca httptinyurlcomqwrrm
1,nike rocks im super grateful for what ive done with them  amp the european division of nike is beyond whitstyles muchasmuertes
1,top ten most watched on viralvideo chart  love the nike mostvaluablepuppets campaign from wieden amp kennedy httpbitlynrn
1,excited about seeing bobby flay and guy fieri tomorrow at the great american food amp music fest
1,safeway with marvin janelle and auntie lhu
1,hey guys everyone add mattwayneceleb please and thank you 
1,is studing math  tomorrow exam and dentist 
1,ok first assesment of the kindle it fucking rocks
1,blueflameit i wish they are all ex red arrows and i have had the privilege of flying with them  httpthebladesbiz
0,sorry for the strip nav bar being broken nobody told me so i could fix them   i put in a temporary fix until i have a bit of time later
1,rt clashmore httpbitlysoyv  great article by malcolm gladwell
1,bars on monday  awesome  
0,i have to face up to the facts i need glasses  
0,omg  time warner fed up my internet install  instead of today  its now next saturday  another week wo internet ampehfavfhg fml
1,i just extracted and opensourced a jquery plugin from stormweight to highlight text with a regular expression httpbitlyybjkb
1,uscsports lebron is a monsta and he is only  smh the world aint ready
1,i like this guy   barack obama shows his funny side  gtgt httptrimlgy 
1,no hunny there are no vampires  just bloodsucking salespeople that steal daddys money  day  as a lycan
0,nocturnalia i so wish it was thursday 
1,i love dwight howards vitamin water commercial now i wish he was with nike and not adidas lol
1,is scrapbooking with nic d
1,ncaa baseball super regional  rams club httpbitlyronx
0,last  exams tomorrow  both chemistry and right after each other 
1,going out soon got mileys cd 
0,jacekdudzic  but you have paczki and mazurki which more than makes up for your lack of venti cafe mochas 
0,waiting for my husband who is sitll on a meeting at the office 
0,trying not to lose more of my voice 
0,morind because the twitter api is slow and most clients arent good
0,is gutted to be missing drinktank tonight  but it is my brothers birthday afterall sigh
1,jakes going to safeway
0,yahoo answers can be a butt sometimes
1,the nike training club beta iphone app looks very interesting
1,pjharry you got it 
1,accannis edog great stanford course thanks for making it available to the public really helpful and informative for starting off
0,i hate rain 
1,httpisgdaruj good video from google on using search options
0,sitting in the metro and going to work 
1,champions league back on tonight 
0,hate safeway select green tea icecream bought two cartons what a waste of money  gtlt
0,is soooo worried about the state of iran 
1,jerichok haha its pm here good afternoon 
1,lookin mellyford bet right now shes like kryptonite  she stops  me dead on my feet love my melly 
1,allstar basketball classic tuesday features top talent chattanoogas notre dame high school will play host httpbitlyqltja